{
  "schema_version": "2.0.0",
  "meta": {
    "mock": true,
    "created_at": "2026-07-14T20:00:00+09:00",
    "language": "ko-KR"
  },
  "meeting_id": "MTG-MOCK-001",
  "project_id": "PRJ-MOCK-001",
  "document_id": "DOC-MOCK-001",
  "title": "AI 기반 소상공인 재고관리 서비스 사업계획서 검토",
  "status": "completed",
  "domain": "startup",
  "rubric": {
    "rubric_id": "RUBRIC-MOCK-001",
    "source_document_id": "NOTICE-MOCK-001",
    "total_max_score": 100,
    "criteria": [
      {
        "criterion_id": "marketability",
        "criterion_name": "시장성",
        "max_score": 30,
        "required": true,
        "description": "타깃 고객, 시장 수요, 성장 가능성의 구체성과 근거를 평가한다."
      },
      {
        "criterion_id": "technical_feasibility",
        "criterion_name": "기술·실현 가능성",
        "max_score": 30,
        "required": true,
        "description": "기술 적합성, 구현 가능성, 데이터 확보 및 운영 계획을 평가한다."
      },
      {
        "criterion_id": "differentiation",
        "criterion_name": "차별성",
        "max_score": 20,
        "required": false,
        "description": "기존 대비 독창성과 경쟁력을 평가한다."
      },
      {
        "criterion_id": "execution_plan",
        "criterion_name": "실행계획",
        "max_score": 20,
        "required": true,
        "description": "일정, 인력, 자원, 위험관리 계획의 구체성을 평가한다."
      }
    ]
  },
  "reviewer_results": [
    {
      "review_id": "REV-MOCK-001",
      "persona_id": "business_strategy",
      "persona_name": "사업전략 전문가",
      "role": "사업전략 전문가",
      "review_round": 1,
      "summary": "타깃 고객과 문제는 명확하나 시장 수요를 입증할 근거가 부족하다. 고객 검증 자료와 경쟁 서비스 비교를 우선 보강해야 한다.",
      "rubric_scores": [
        {
          "criterion_id": "marketability",
          "criterion_name": "시장성",
          "score": 20,
          "max_score": 30,
          "judgment": "needs_improvement",
          "strengths": [
            "타깃 고객을 재고관리 인력이 없는 소규모 오프라인 매장으로 구체화했다."
          ],
          "issues": [
            "고객 인터뷰나 설문 결과가 없어 문제의 빈도와 지불 의사를 확인하기 어렵다."
          ],
          "suggestions": [
            "최소 10명 이상의 타깃 고객 인터뷰 결과와 공통 불편 사항을 추가한다.",
            "목표 시장 규모의 산정 기준과 출처를 명시한다."
          ],
          "evidence_ids": [
            "ev_001",
            "ev_002"
          ],
          "evidence_status": "partial"
        },
        {
          "criterion_id": "differentiation",
          "criterion_name": "차별성",
          "score": 11,
          "max_score": 20,
          "judgment": "needs_improvement",
          "strengths": [
            "별도 학습 없이 쓰는 자동 발주 추천을 차별 요소로 제시했다."
          ],
          "issues": [
            "기존 POS·재고관리 서비스 대비 차이가 기능 설명 수준에 머문다."
          ],
          "suggestions": [
            "경쟁 서비스 3개와 비교표(대상 고객·입력 방식·추천 기능·가격)를 작성한다."
          ],
          "evidence_ids": [
            "ev_003"
          ],
          "evidence_status": "partial"
        }
      ],
      "cross_reviews": [],
      "out_of_scope": [
        {
          "topic": "AI 발주 추천 모델의 구현 가능성",
          "reason": "모델 학습 데이터와 구현 난이도에 대한 기술 검토가 필요하다.",
          "handoff_persona_id": "technical_feasibility"
        }
      ],
      "confidence": "high"
    },
    {
      "review_id": "REV-MOCK-002",
      "persona_id": "technical_feasibility",
      "persona_name": "기술·실현가능성 전문가",
      "role": "기술·실현가능성 전문가",
      "review_round": 2,
      "summary": "기본 웹 서비스 구현은 가능하나, 8주 안에 데이터 수집부터 개인화 추천까지 동시에 완성하려는 일정의 위험이 크다. 규칙 기반 PoC 후 모델 고도화하는 단계적 접근이 필요하다.",
      "rubric_scores": [
        {
          "criterion_id": "technical_feasibility",
          "criterion_name": "기술·실현 가능성",
          "score": 18,
          "max_score": 30,
          "judgment": "needs_improvement",
          "strengths": [
            "판매 이력과 재고 데이터를 핵심 입력으로 명시했다.",
            "웹 대시보드를 MVP 제공 방식으로 선택했다."
          ],
          "issues": [
            "초기 학습 데이터 확보 규모와 품질 관리 방법이 없다.",
            "추천 정확도를 검증할 지표와 기준값이 제시되지 않았다."
          ],
          "suggestions": [
            "PoC는 규칙 기반 발주 추천으로 구현하고 데이터 축적 후 예측 모델로 전환하는 단계 계획을 작성한다.",
            "추천 오차율, 품절 감소율 등 검증 지표를 정의한다."
          ],
          "evidence_ids": [
            "ev_004",
            "ev_005"
          ],
          "evidence_status": "partial"
        },
        {
          "criterion_id": "execution_plan",
          "criterion_name": "실행계획",
          "score": 12,
          "max_score": 20,
          "judgment": "critical_risk",
          "strengths": [
            "전체 개발 기간을 8주로 명시했다."
          ],
          "issues": [
            "데이터 수집·모델 개발·웹 개발·현장 검증이 같은 기간에 병렬 배치되어 있다.",
            "외부 POS 연동 실패 시 대체 입력 방식이 없다."
          ],
          "suggestions": [
            "8주 목표를 데이터 입력·기본 대시보드·규칙 기반 추천으로 축소하고 모델 고도화는 후속 단계로 분리한다.",
            "POS 연동 지연 시 CSV 업로드 대체 계획을 추가한다."
          ],
          "evidence_ids": [
            "ev_006"
          ],
          "evidence_status": "sufficient"
        }
      ],
      "cross_reviews": [
        {
          "target_persona_id": "business_strategy",
          "relation": "supplement",
          "target_criterion_id": "differentiation",
          "comment": "AI 추천이 차별 요소가 되려면 초기 데이터 부족 상황에서도 실제 품질을 입증할 단계별 성능 검증 계획이 함께 제시되어야 한다.",
          "evidence_ids": [
            "ev_005"
          ]
        }
      ],
      "out_of_scope": [
        {
          "topic": "타깃 고객의 실제 지불 의사",
          "reason": "고객 시장의 수익성에 대한 사업 관점 검토가 필요하다.",
          "handoff_persona_id": "business_strategy"
        }
      ],
      "confidence": "high"
    }
  ],
  "score_result": {
    "total_score": 61,
    "max_score": 100,
    "score_label": "evaluation_criteria_alignment",
    "calculation_version": "score_v2",
    "calculation_method": "criterion_owner",
    "breakdown": [
      {
        "criterion_id": "marketability",
        "raw_score": 20,
        "max_score": 30,
        "weight": 30,
        "weighted_score": 20,
        "penalty": 0,
        "source_review_ids": [
          "REV-MOCK-001"
        ]
      },
      {
        "criterion_id": "technical_feasibility",
        "raw_score": 18,
        "max_score": 30,
        "weight": 30,
        "weighted_score": 18,
        "penalty": 0,
        "source_review_ids": [
          "REV-MOCK-002"
        ]
      },
      {
        "criterion_id": "differentiation",
        "raw_score": 11,
        "max_score": 20,
        "weight": 20,
        "weighted_score": 11,
        "penalty": 0,
        "source_review_ids": [
          "REV-MOCK-001"
        ]
      },
      {
        "criterion_id": "execution_plan",
        "raw_score": 12,
        "max_score": 20,
        "weight": 20,
        "weighted_score": 12,
        "penalty": 0,
        "source_review_ids": [
          "REV-MOCK-002"
        ]
      }
    ],
    "penalties": []
  },
  "chair_summary": {
    "chair_id": "review_chair",
    "overall_assessment": "문제와 타깃 고객은 명확하지만, 고객 수요 검증과 AI 추천 기능의 단계적 구현 계획이 부족하다. 시장 검증 자료를 보강하고 MVP 범위를 축소하면 사업성과 실현 가능성을 함께 높일 수 있다.",
    "consensus": [
      "타깃 고객과 해결하려는 문제는 비교적 명확하다.",
      "AI 추천 기능을 뒷받침할 고객 검증과 데이터 확보 계획이 부족하다.",
      "현재 8주 MVP 범위는 축소가 필요하다."
    ],
    "disagreements": [],
    "top_strengths": [
      "소규모 오프라인 매장이라는 타깃 고객이 구체적이다.",
      "재고 부족과 폐기 문제를 해결하려는 서비스 목적이 분명하다."
    ],
    "top_risks": [
      "고객 시장의 지불 의사를 입증할 근거가 없다.",
      "초기 데이터 없이 개인화 추천 모델을 완성하려는 일정 위험이 크다.",
      "기존 서비스 대비 차별성이 충분히 검증되지 않았다."
    ],
    "final_decision": null,
    "decision_note": "Mock 데이터에서는 합격·불합격 기준이 제공되지 않아 최종 판정을 내리지 않는다."
  },
  "top_revisions": [
    {
      "priority": 1,
      "title": "고객 수요 검증 자료 추가",
      "reason": "시장 수요를 입증할 직접 근거가 부족하다.",
      "target": "시장성 / 고객 정의 섹션",
      "action": "타깃 고객 인터뷰·설문 결과와 공통 불편 사항을 추가한다.",
      "related_criteria": [
        "marketability"
      ],
      "evidence_ids": [
        "ev_001",
        "ev_002"
      ]
    },
    {
      "priority": 2,
      "title": "MVP 범위 축소 및 단계화",
      "reason": "8주에 데이터 수집과 개인화 모델을 동시에 추진하기 어렵다.",
      "target": "실행계획 / 개발 일정 섹션",
      "action": "기본 대시보드와 규칙 기반 추천으로 MVP를 축소하고 모델 고도화를 후속 단계로 분리한다.",
      "related_criteria": [
        "technical_feasibility",
        "execution_plan"
      ],
      "evidence_ids": [
        "ev_006"
      ]
    },
    {
      "priority": 3,
      "title": "경쟁 서비스 비교표와 검증 계획",
      "reason": "차별성 주장이 경쟁 대상과 비교되지 않았다.",
      "target": "차별성 섹션",
      "action": "경쟁 서비스 비교표와 단계별 성능 검증 계획을 추가한다.",
      "related_criteria": [
        "differentiation"
      ],
      "evidence_ids": [
        "ev_003",
        "ev_005"
      ]
    }
  ],
  "evidence": [
    {
      "evidence_id": "ev_001",
      "chunk_id": "CHUNK-004",
      "document_name": "사업계획서.pdf",
      "source_type": "submission",
      "page": 3,
      "section": "고객 정의",
      "text": "주요 고객은 재고관리 전담 인력이 없는 소규모 오프라인 매장이다.",
      "quote": "주요 고객은 재고관리 전담 인력이 없는 소규모 오프라인 매장이다.",
      "relevance": "타깃 고객이 구체적으로 정의되었음을 보여준다.",
      "score": 0.88
    },
    {
      "evidence_id": "ev_002",
      "chunk_id": "CHUNK-006",
      "document_name": "사업계획서.pdf",
      "source_type": "submission",
      "page": 4,
      "section": "시장 검증",
      "text": "제품 개발 이후 고객 인터뷰를 진행할 예정이다.",
      "quote": "제품 개발 이후 고객 인터뷰를 진행할 예정이다.",
      "relevance": "현재 단계에서 시장 검증이 완료되지 않았음을 보여준다.",
      "score": 0.82
    },
    {
      "evidence_id": "ev_003",
      "chunk_id": "CHUNK-010",
      "document_name": "사업계획서.pdf",
      "source_type": "submission",
      "page": 6,
      "section": "핵심 기능",
      "text": "AI가 판매 이력을 분석하여 다음 발주 수량을 자동으로 추천한다.",
      "quote": "AI가 판매 이력을 분석하여 다음 발주 수량을 자동으로 추천한다.",
      "relevance": "제안 서비스가 주장하는 핵심 차별 기능이다.",
      "score": 0.85
    },
    {
      "evidence_id": "ev_004",
      "chunk_id": "CHUNK-014",
      "document_name": "사업계획서.pdf",
      "source_type": "submission",
      "page": 8,
      "section": "기술 구성",
      "text": "판매 이력과 현재 재고를 학습하여 매장별 발주량을 추천한다.",
      "quote": "판매 이력과 현재 재고를 학습하여 매장별 발주량을 추천한다.",
      "relevance": "추천 기능에 필요한 입력 데이터는 정의되어 있으나 확보 방식은 확인되지 않는다.",
      "score": 0.8
    },
    {
      "evidence_id": "ev_005",
      "chunk_id": "CHUNK-017",
      "document_name": "사업계획서.pdf",